{
  "name": "USD Coin",
  "symbol": "USDC",
  "type": "ERC20",
  "decimals": 6,
  "status": "active",
  "id": "0xaf88d065e77c8cC2239327C5EDb3A432268e5831",
  "description": "Native USD Coin on Arbitrum.",
  "website": "https://www.circle.com/usdc",
  "explorer": "https://arbiscan.io/token/0xaf88d065e77c8cC2239327C5EDb3A432268e5831",
  "tags": ["stablecoin", "defi"],
  "links": [
    {"name": "twitter", "url": "https://x.com/circle"},
    {"name": "coingecko", "url": "https://www.coingecko.com/en/coins/usd-coin"}
  ],
  "pricing": {
    "coingecko_id": "usd-coin"
  }
}
