{
  "name": "Tether USD",
  "symbol": "USDT",
  "type": "ERC20",
  "decimals": 6,
  "status": "active",
  "id": "0xdAC17F958D2ee523a2206206994597C13D831ec7",
  "description": "Tether is a stablecoin pegged to the US Dollar, backed by reserves.",
  "website": "https://tether.to",
  "explorer": "https://etherscan.io/token/0xdAC17F958D2ee523a2206206994597C13D831ec7",
  "tags": ["stablecoin", "defi"],
  "links": [
    {"name": "twitter", "url": "https://x.com/Tether_to"},
    {"name": "coingecko", "url": "https://www.coingecko.com/en/coins/tether"}
  ],
  "pricing": {
    "coingecko_id": "tether"
  }
}
