{
  "id": "0x68f180fcCe6836688e9084f035309E29Bf0A2095",
  "name": "Wrapped Bitcoin",
  "symbol": "WBTC",
  "type": "ERC20",
  "decimals": 8,
  "description": "Wrapped Bitcoin is an ERC20 token backed 1:1 by Bitcoin",
  "website": "https://wbtc.network",
  "explorer": "https://optimistic.etherscan.io/token/0x68f180fcCe6836688e9084f035309E29Bf0A2095",
  "status": "active",
  "tags": ["wrapped", "bitcoin"]
}
