{
  "name": "TrueUSD",
  "symbol": "TUSD",
  "type": "ERC20",
  "decimals": 18,
  "status": "active",
  "id": "0x0000000000085d4780B73119b644AE5ecd22b376",
  "description": "TrueUSD is a stablecoin backed 1:1 by U.S. dollars with live on-chain attestations by independent third-party institutions.",
  "website": "https://tusd.io/",
  "explorer": "https://etherscan.io/token/0x0000000000085d4780B73119b644AE5ecd22b376",
  "tags": ["stablecoin"],
  "links": [
    {"name": "twitter", "url": "https://x.com/tusdio"},
    {"name": "coingecko", "url": "https://www.coingecko.com/en/coins/true-usd"}
  ],
  "pricing": {
    "coingecko_id": "true-usd"
  }
}
