{
  "name": "Polkadot",
  "symbol": "DOT",
  "type": "native",
  "decimals": 10,
  "status": "active",
  "id": "DOT",
  "description": "Polkadot is a blockchain project that aims to connect blockchains, to enable the transfer of value and logic across chains.",
  "website": "https://polkadot.com/",
  "explorer": "https://polkadot.subscan.io/",
  "api": {
    "mainnet": {
      "node": ["wss://rpc.polkadot.io", "wss://polkadot-rpc.dwellir.com"]
    },
    "testnet": {
      "node": ["wss://westend-rpc.polkadot.io"]
    }
  },
  "tags": ["smart-contracts", "staking-native", "layer-0", "parachain"],
  "links": [
    {"name": "github", "url": "https://github.com/paritytech/polkadot-sdk"},
    {"name": "twitter", "url": "https://x.com/polkadotnetwork"},
    {"name": "reddit", "url": "https://reddit.com/r/dot"},
    {"name": "whitepaper", "url": "https://polkadot.network/PolkaDotPaper.pdf"}
  ],
  "pricing": {
    "coingecko_id": "polkadot"
  },
  "staking": {
    "enabled": true,
    "type": "native",
    "native_staking": true,
    "rewards_token": "DOT"
  }
}
